Review ID,Author Name,Review Text,Star Rating,Helpfulness Count,Device Type,Date,topics_sentiments,overall_sentiment
PP1NOQU9,Hannah Montana,"The integration with my bank was seamless, but I wish I could have more control over my transaction limits within the app. Overall, I’m satisfied. However, there are areas that could be improved.",3,60,Chromebook,2024-03-14,"[{'topic': 'Integration', 'sentiment': 'Positive'}, {'topic': 'Bank', 'sentiment': 'Positive'}, {'topic': 'Seamless', 'sentiment': 'Positive'}, {'topic': 'Control', 'sentiment': 'Neutral'}, {'topic': 'Transaction limits', 'sentiment': 'Neutral'}, {'topic': 'App', 'sentiment': 'Neutral'}, {'topic': 'Satisfied', 'sentiment': 'Positive'}, {'topic': 'Areas for improvement', 'sentiment': 'Negative'}]",Positive
4H20RAPE,Quinn Fabray,"Overall, it’s a solid app, but I’d like to see a better integration with banking systems to simplify transfers. However, there are areas that could be improved.",3,124,Tablet,2024-06-15,"[{'topic': 'Solid app', 'sentiment': 'Positive'}, {'topic': 'integration', 'sentiment': 'Positive'}, {'topic': 'banking systems', 'sentiment': 'Positive'}, {'topic': 'transfers', 'sentiment': 'Positive'}, {'topic': 'areas', 'sentiment': 'Negative'}, {'topic': 'improved', 'sentiment': 'Positive'}]",Positive
UUOYC3RW,Oscar Isaac,"This app has been my primary money management tool. I find it very convenient, but there are times when the app freezes, which is frustrating. However, there are areas that could be improved.",3,92,Tablet,2024-01-09,"[{'topic': 'Money management', 'sentiment': 'Neutral'}, {'topic': 'Convenient', 'sentiment': 'Neutral'}, {'topic': 'Freezes', 'sentiment': 'Negative'}, {'topic': 'Frustrating', 'sentiment': 'Negative'}, {'topic': 'Improvements', 'sentiment': 'Neutral'}]",Negative
U3MOMYVU,Ricky Bobby,"Cash App is pretty good for transfering money, but it can be a little slow when receiving funds. I hope they can improve that in the next update.",3,90,Tablet,2023-11-12,"[{'topic': 'Cash App', 'sentiment': 'Positive'}, {'topic': 'transfering money', 'sentiment': 'Positive'}, {'topic': 'slow receiving funds', 'sentiment': 'Negative'}, {'topic': 'improvement', 'sentiment': 'Positive'}, {'topic': 'next update', 'sentiment': 'Positive'}]",Positive
S1QCWQ85,Kylie Jenner,"I've enjoyed using Cash App! It’s user-friendly, but I think it could benefit from additional features to make it even more versatile.",5,146,Tablet,2024-09-15,"[{'topic': 'Cash App', 'sentiment': 'Positive'}, {'topic': 'user-friendly', 'sentiment': 'Positive'}, {'topic': 'additional features', 'sentiment': 'Positive'}, {'topic': 'versatile', 'sentiment': 'Positive'}]",Positive
